{
  "check_id": "CHK-STEMI-DO-004-20260318-RSSMRA58",
  "check_timestamp": "2026-03-23T12:00:00+01:00",
  "rule_id": "STEMI-DO-004",
  "patient_id_hash": "RSSMRA58L12H501X",
  "outcome": "compliant",
  "confidence": 0.7,
  "rationale": "Il paziente soddisfa pienamente i criteri di inclusione della regola: sospetta SCA con alterazioni ECG e dolore toracico in corso fin dalla fase pre-ospedaliera (FMC 07:44), con successiva conferma diagnostica di STEMI inferiore (ECG delle 11:02). Per quanto riguarda il monitoraggio ECG continuo, la scheda di triage (doc 3, ore 08:02) documenta esplicitamente l'instradamento in 'area emergenza ad alta intensità con monitoraggio continuo', indicando attivazione del monitoraggio ECG continuo contestuale all'arrivo in PS, circa 18 minuti dopo il FMC. L'ingresso in UTIC (doc 17, ore 14:45) conferma il collegamento a 'monitor multiparametrico e telemetria continua', e molteplici diari clinici e infermieristici successivi (doc 19, 20, 22, 26, 27) riportano rilievi telemetrici continui senza interruzioni fino alla dimissione dalla fase intensiva. Il monitoraggio risulta quindi mantenuto durante tutte le fasi critiche (PS, emodinamica, UTIC). Per quanto concerne la disponibilità del defibrillatore, non è presente documentazione esplicita (checklist, log dispositivo, nota infermieristica dedicata) della verifica della disponibilità e funzionalità di un defibrillatore. Tuttavia, il paziente è stato gestito in setting (area emergenza PS ad alta intensità, laboratorio di emodinamica, UTIC) dove la dotazione di defibrillatore è standard e obbligatoria per normativa. La fase pre-ospedaliera (118) documenta l'esecuzione di ECG e terapia e.v. ma non menziona esplicitamente monitoraggio continuo durante il trasporto, sebbene l'equipaggiamento del mezzo con medico a bordo includa di norma monitor-defibrillatore. L'outcome è compliant con confidence moderata (0.70) poiché il requisito sostanziale del monitoraggio ECG continuo è chiaramente documentato e la disponibilità del defibrillatore è fortemente inferibile dai setting di cura, ma manca documentazione esplicita e strutturata della verifica del defibrillatore e degli identificativi dei dispositivi di monitoraggio, come richiesto dai criteri di completezza della regola.",
  "supporting_documents": [
    {
      "document_id": "3",
      "rationale": "La scheda di triage PS (08:02) documenta esplicitamente l'instradamento del paziente in 'area emergenza ad alta intensità con monitoraggio continuo', costituendo la prima evidenza di attivazione del monitoraggio ECG continuo in ambito ospedaliero, circa 18 minuti dopo il FMC.",
      "confidence": 0.82
    },
    {
      "document_id": "2",
      "rationale": "Il verbale 118 documenta il primo contatto medico (FMC 07:44), l'esecuzione dell'ECG pre-ospedaliero e il trasporto protetto con medico a bordo, ma non riporta esplicitamente l'attivazione di monitoraggio ECG continuo né la verifica del defibrillatore durante il trasporto. La presenza del medico 118 e la capacità di eseguire ECG suggeriscono disponibilità di monitor-defibrillatore.",
      "confidence": 0.5
    },
    {
      "document_id": "4",
      "rationale": "La valutazione medica PS (08:11) conferma l'impostazione di un iter di monitoraggio intensivo con ECG seriati, coerente con la sorveglianza continua documentata al triage, in un paziente con SCA ad alto rischio.",
      "confidence": 0.65
    },
    {
      "document_id": "17",
      "rationale": "Il diario infermieristico UTIC (14:45) documenta esplicitamente il collegamento a 'monitor multiparametrico e telemetria continua' all'ingresso in UTIC post-PCI, confermando la continuità del monitoraggio ECG nella fase critica post-riperfusione.",
      "confidence": 0.85
    },
    {
      "document_id": "19",
      "rationale": "Il diario clinico UTIC serale (18:40) riporta 'telemetria con ritmo sinusale stabile, sporadiche extrasistoli ventricolari isolate', confermando il monitoraggio ECG continuo attivo e funzionante con rilevazione di aritmie.",
      "confidence": 0.8
    },
    {
      "document_id": "20",
      "rationale": "Il diario infermieristico notturno (23:00) conferma 'Telemetria continua in ritmo sinusale, non episodi ischemici', documentando la prosecuzione ininterrotta del monitoraggio ECG durante il turno notturno in UTIC.",
      "confidence": 0.78
    },
    {
      "document_id": "9",
      "rationale": "L'ECG delle 11:02 documenta la comparsa di STEMI inferiore franco, rappresentando il momento di conferma diagnostica. Il fatto che l'evoluzione ECG sia stata colta con ECG seriato supporta la presenza di sorveglianza clinica attiva, sebbene il monitoraggio continuo fosse già attivo dal triage.",
      "confidence": 0.6
    }
  ]
}
